doi,title,authors_str,pub_date,journal,abstract,pmid,pmid_link,pmcid,pmcid_link,citation_count,s2_paper_id
10.1111/gcb.17119,Modelling the probability of meeting IUCN Red List criteria to support reassessments.,Etienne G Henry; Luca Santini; Stuart H M Butchart; Manuela González-Suárez; Pablo M Lucas; Ana Benítez-López; Giordano Mancini; Martin Jung; Pedro Cardoso; Alexander Zizka; Carsten Meyer; H Reşit Akçakaya; Alex J Berryman; Victor Cazalis; Moreno Di Marco,2024-01-01,Global change biology,"Comparative extinction risk analysis-which predicts species extinction risk from correlation with traits or geographical characteristics-has gained research attention as a promising tool to support extinction risk assessment in the IUCN Red List of Threatened Species. However, its uptake has been very limited so far, possibly because existing models only predict a species' Red List category, without indicating which Red List criteria may be triggered. This prevents such approaches to be integrated into Red List assessments. We overcome this implementation gap by developing models that predict the probability of species meeting individual Red List criteria. Using data on the world's birds, we evaluated the predictive performance of our criterion-specific models and compared it with the typical criterion-blind modelling approach. We compiled data on biological traits (e.g. range size, clutch size) and external drivers (e.g. change in canopy cover) often associated with extinction risk. For each specific criterion, we modelled the relationship between extinction risk predictors and species' Red List category under that criterion using ordinal regression models. We found criterion-specific models were better at identifying threatened species compared to a criterion-blind model (higher sensitivity), but less good at identifying not threatened species (lower specificity). As expected, different covariates were important for predicting extinction risk under different criteria. Change in annual temperature was important for criteria related to population trends, while high forest dependency was important for criteria related to restricted area of occupancy or small population size. Our criteria-specific method can support Red List assessors by producing outputs that identify species likely to meet specific criteria, and which are the most important predictors. These species can then be prioritised for re-evaluation. We expect this new approach to increase the uptake of extinction risk models in Red List assessments, bridging a long-standing research-implementation gap.",38273572,https://pubmed.ncbi.nlm.nih.gov/38273572/,,,,
10.1111/cobi.14227,A standard approach for including climate change responses in IUCN Red List assessments.,Giordano Mancini; Luca Santini; Victor Cazalis; H Reşit Akçakaya; Pablo M Lucas; Thomas M Brooks; Wendy Foden; Moreno Di Marco,2024-06-01,Conservation biology : the journal of the Society for Conservation Biology,"The International Union for Conservation of Nature (IUCN) Red List is a central tool for extinction risk monitoring and influences global biodiversity policy and action. But, to be effective, it is crucial that it consistently accounts for each driver of extinction. Climate change is rapidly becoming a key extinction driver, but consideration of climate change information remains challenging for the IUCN. Several methods can be used to predict species' future decline, but they often fail to provide estimates of the symptoms of endangerment used by IUCN. We devised a standardized method to measure climate change impact in terms of change in habitat quality to inform criterion A3 on future population reduction. Using terrestrial nonvolant tetrapods as a case study, we measured this impact as the difference between the current and the future species climatic niche, defined based on current and future bioclimatic variables under alternative model algorithms, dispersal scenarios, emission scenarios, and climate models. Our models identified 171 species (13% out of those analyzed) for which their current red-list category could worsen under criterion A3 if they cannot disperse beyond their current range in the future. Categories for 14 species (1.5%) could worsen if maximum dispersal is possible. Although ours is a simulation exercise and not a formal red-list assessment, our results suggest that considering climate change impacts may reduce misclassification and strengthen consistency and comprehensiveness of IUCN Red List assessments.",38111977,https://pubmed.ncbi.nlm.nih.gov/38111977/,,,,
10.1111/nph.19295,Re-evaluating the importance of threatened species in maintaining global phytoregions.,Matilda J M Brown; Barnaby E Walker; Andrew P Budden; Eimear Nic Lughadha,2023-11-01,The New phytologist,"Anthropogenic introductions are known to be changing the structure of global phytogeographical regions (phytoregions), but previous studies have been limited by incomplete or biased data sets that are likely to underestimate the importance of threatened species. In this work, we analyse a comprehensive data set of all known species and their occurrences (at botanical country resolution) to quantify the impact of potential future extinction scenarios. We used Infomap, a network-based community detection algorithm, to generate phytoregional delineations for six species-distribution scenarios (native, introduced and extinctions of species that are either documented as threatened or likely to be threatened, as well as combinations thereof). We compared the numbers and sizes of phytoregions to characterise the amount and spatial distribution of changes in global phytoregions under each scenario. Extinctions of species that are predicted to be threatened had a greater homogenising effect on phytoregions than introductions, and there was some evidence that introductions may even mitigate the homogenisation caused by extinctions, though this interaction is complex. This research provides the first evidence that the loss of threatened species would have significant ramifications for global phytoregions and demonstrates the need to consider extinction processes in studies of anthropogenic effects on biodiversity patterns.",37798820,https://pubmed.ncbi.nlm.nih.gov/37798820/,,,,
10.1016/j.cub.2023.07.047,Incorporating global change reveals extinction risk beyond the current Red List.,Shijia Peng; Nawal Shrestha; Yuan Luo; Yaoqi Li; Hongyu Cai; Haining Qin; Keping Ma; Zhiheng Wang,2023-09-11,Current biology : CB,"Global changes over the past few decades have caused species distribution shifts and triggered population declines and local extinctions of many species. The International Union for Conservation of Nature (IUCN) Red List of Threatened Species (Red List) is regarded as the most comprehensive tool for assessing species extinction risk and has been used at regional, national, and global scales. However, most Red Lists rely on the past and current status of species populations and distributions but do not adequately reflect the risks induced by future global changes. Using distribution maps of >4,000 endemic woody species in China, combined with ensembled species distribution models, we assessed the species threat levels under future climate and land-cover changes using the projected changes in species' suitable habitats and compared our updated Red List with China's existing Red List. We discover an increased number of threatened species in the updated Red List and increased threat levels of >50% of the existing threatened species compared with the existing one. Over 50% of the newly identified threatened species are not adequately covered by protected areas. The Yunnan-Guizhou Plateau, rather than the Hengduan Mountains, is the distribution center of threatened species on the updated Red Lists, as opposed to the threatened species on the existing Red List. Our findings suggest that using Red Lists without considering the impacts of future global changes will underestimate the extinction risks and lead to a biased estimate of conservation priorities, potentially limiting the ability to meet the Kunming-Montreal global conservation targets.",37591250,https://pubmed.ncbi.nlm.nih.gov/37591250/,,,,
10.1111/nph.19214,Three in four undescribed plant species are threatened with extinction.,Matilda J M Brown; Steven P Bachman; Eimear Nic Lughadha,2023-11-01,The New phytologist,,37583098,https://pubmed.ncbi.nlm.nih.gov/37583098/,,,,
10.1111/cobi.14139,Prioritizing the reassessment of data-deficient species on the IUCN Red List.,Victor Cazalis; Luca Santini; Pablo M Lucas; Manuela González-Suárez; Michael Hoffmann; Ana Benítez-López; Michela Pacifici; Aafke M Schipper; Monika Böhm; Alexander Zizka; Viola Clausnitzer; Carsten Meyer; Martin Jung; Stuart H M Butchart; Pedro Cardoso; Giordano Mancini; H Reşit Akçakaya; Bruce E Young; Guillaume Patoine; Moreno Di Marco,2023-12-01,Conservation biology : the journal of the Society for Conservation Biology,"Despite being central to the implementation of conservation policies, the usefulness of the International Union for Conservation of Nature (IUCN) Red List of Threatened Species is hampered by the 14% of species classified as data-deficient (DD) because information to evaluate these species' extinction risk was lacking when they were last assessed or because assessors did not appropriately account for uncertainty. Robust methods are needed to identify which DD species are more likely to be reclassified in one of the data-sufficient IUCN Red List categories. We devised a reproducible method to help red-list assessors prioritize reassessment of DD species and tested it with 6887 DD species of mammals, reptiles, amphibians, fishes, and Odonata (dragonflies and damselflies). For each DD species in these groups, we calculated its probability of being classified in a data-sufficient category if reassessed today from covariates measuring available knowledge (e.g., number of occurrence records or published articles available), knowledge proxies (e.g., remoteness of the range), and species characteristics (e.g., nocturnality); calculated change in such probability since last assessment from the increase in available knowledge (e.g., new occurrence records); and determined whether the species might qualify as threatened based on recent rate of habitat loss determined from global land-cover maps. We identified 1907 species with a probability of being reassessed in a data-sufficient category of >0.5; 624 species for which this probability increased by >0.25 since last assessment; and 77 species that could be reassessed as near threatened or threatened based on habitat loss. Combining these 3 elements, our results provided a list of species likely to be data-sufficient such that the comprehensiveness and representativeness of the IUCN Red List can be improved.",37394972,https://pubmed.ncbi.nlm.nih.gov/37394972/,,,,
10.1111/brv.12974,More losers than winners: investigating Anthropocene defaunation through the diversity of population trends.,Catherine Finn; Florencia Grattarola; Daniel Pincheira-Donoso,2023-10-01,Biological reviews of the Cambridge Philosophical Society,"The global-scale decline of animal biodiversity ('defaunation') represents one of the most alarming consequences of human impacts on the planet. The quantification of this extinction crisis has traditionally relied on the use of IUCN Red List conservation categories assigned to each assessed species. This approach reveals that a quarter of the world's animal species are currently threatened with extinction, and ~1% have been declared extinct. However, extinctions are preceded by progressive population declines through time that leave demographic 'footprints' that can alert us about the trajectories of species towards extinction. Therefore, an exclusive focus on IUCN conservation categories, without consideration of dynamic population trends, may underestimate the true extent of the processes of ongoing extinctions across nature. In fact, emerging evidence (e.g. the Living Planet Report), reveals a widespread tendency for sustained demographic declines (an average 69% decline in population abundances) of species globally. Yet, animal species are not only declining. Many species worldwide exhibit stable populations, while others are even thriving. Here, using population trend data for >71,000 animal species spanning all five groups of vertebrates (mammals, birds, reptiles, amphibians and fishes) and insects, we provide a comprehensive global-scale assessment of the diversity of population trends across species undergoing not only declines, but also population stability and increases. We show a widespread global erosion of species, with 48% undergoing declines, while 49% and 3% of species currently remain stable or are increasing, respectively. Geographically, we reveal an intriguing pattern similar to that of threatened species, whereby declines tend to concentrate around tropical regions, whereas stability and increases show a tendency to expand towards temperate climates. Importantly, we find that for species currently classed by the IUCN Red List as 'non-threatened', 33% are declining. Critically, in contrast with previous mass extinction events, our assessment shows that the Anthropocene extinction crisis is undergoing a rapid biodiversity imbalance, with levels of declines (a symptom of extinction) greatly exceeding levels of increases (a symptom of ecological expansion and potentially of evolution) for all groups. Our study contributes a further signal indicating that global biodiversity is entering a mass extinction, with ecosystem heterogeneity and functioning, biodiversity persistence, and human well-being under increasing threat.",37189305,https://pubmed.ncbi.nlm.nih.gov/37189305/,,,,
10.1111/cobi.14064,Genetic diversity and IUCN Red List status.,Chloé Schmidt; Sean Hoban; Margaret Hunter; Ivan Paz-Vinas; Colin J Garroway,2023-08-01,Conservation biology : the journal of the Society for Conservation Biology,"The International Union for Conservation of Nature (IUCN) Red List is an important and widely used tool for conservation assessment. The IUCN uses information about a species' range, population size, habitat quality and fragmentation levels, and trends in abundance to assess extinction risk. Genetic diversity is not considered, although it affects extinction risk. Declining populations are more strongly affected by genetic drift and higher rates of inbreeding, which can reduce the efficiency of selection, lead to fitness declines, and hinder species' capacities to adapt to environmental change. Given the importance of conserving genetic diversity, attempts have been made to find relationships between red-list status and genetic diversity. Yet, there is still no consensus on whether genetic diversity is captured by the current IUCN Red List categories in a way that is informative for conservation. To assess the predictive power of correlations between genetic diversity and IUCN Red List status in vertebrates, we synthesized previous work and reanalyzed data sets based on 3 types of genetic data: mitochondrial DNA, microsatellites, and whole genomes. Consistent with previous work, species with higher extinction risk status tended to have lower genetic diversity for all marker types, but these relationships were weak and varied across taxa. Regardless of marker type, genetic diversity did not accurately identify threatened species for any taxonomic group. Our results indicate that red-list status is not a useful metric for informing species-specific decisions about the protection of genetic diversity and that genetic data cannot be used to identify threat status in the absence of demographic data. Thus, there is a need to develop and assess metrics specifically designed to assess genetic diversity and inform conservation policy, including policies recently adopted by the UN's Convention on Biological Diversity Kunming-Montreal Global Biodiversity Framework.",36751982,https://pubmed.ncbi.nlm.nih.gov/36751982/,,,,
10.1111/nph.18718,Understanding local plant extinctions before it is too late: bridging evolutionary genomics with global ecology.,Moi Exposito-Alonso,2023-03-01,The New phytologist,"Understanding evolutionary genomic and population processes within a species range is key to anticipating the extinction of plant species before it is too late. However, most models of biodiversity risk under global change do not account for the genetic variation and local adaptation of different populations. Population diversity is critical to understanding extinction because different populations may be more or less susceptible to global change and, if lost, would reduce the total diversity within a species. Two new modeling frameworks advance our understanding of extinction from a population and evolutionary angle: Rapid climate change-driven disruptions in population adaptation are predicted from associations between genomes and local climates. Furthermore, losses of population diversity from global land-use transformations are estimated by scaling relationships of species' genomic diversity with habitat area. Overall, these global eco-evolutionary methods advance the predictability - and possibly the preventability - of the ongoing extinction of plant species.",36604850,https://pubmed.ncbi.nlm.nih.gov/36604850/,,,,
10.1111/cobi.14001,Understanding the drivers of expert opinion when classifying species as extinct.,David L Roberts; Amy Hinsley; Sicily Fiennes; Diogo Veríssimo,2023-02-01,Conservation biology : the journal of the Society for Conservation Biology,"The criteria as laid out by the International Union for the Conservation of Nature (IUCN) Red List are the gold standard by which the extinction risk of a species is assessed and where appropriate biological extinctions are declared. However, unlike all other categories, the category of extinct lacks a quantitative framework for assigning this category. Given its subjective nature, we surveyed expert assessors working on a diversity of taxa to explore the attributes they used to declare a species extinct. Using a choice experiment approach, we surveyed 674 experts from the IUCN Species Survival Commission specialist groups and taskforces. Data availability, time from the last sighting, detectability, habitat availability, and population decline were all important attributes favored by assessors when inferring extinction. Respondents with red-listing experience assigned more importance to the attributes data availability, time from the last sighting, and detectability when considering a species extinction, whereas those respondents working with well-known taxa gave more importance to the time from the last sighting. Respondents with no red-listing experience and those working with more well-known taxa (i.e., mammals and birds) were overall less likely to consider species extinct. Our findings on the importance assessors place on attributes used to declare a species extinct provide a basis for informing the development of specific criteria for more accurately assessing species extinctions.",36073325,https://pubmed.ncbi.nlm.nih.gov/36073325/,PMC10099933,https://www.ncbi.nlm.nih.gov/pmc/articles/PMC10099933/,,
10.1038/s42003-022-03638-9,More than half of data deficient species predicted to be threatened by extinction.,Jan Borgelt; Martin Dorber; Marthe Alnes Høiberg; Francesca Verones,2022-08-04,Communications biology,"The IUCN Red List of Threatened Species is essential for practical and theoretical efforts to protect biodiversity. However, species classified as ""Data Deficient"" (DD) regularly mislead practitioners due to their uncertain extinction risk. Here we present machine learning-derived probabilities of being threatened by extinction for 7699 DD species, comprising 17% of the entire IUCN spatial datasets. Our predictions suggest that DD species as a group may in fact be more threatened than data-sufficient species. We found that 85% of DD amphibians are likely to be threatened by extinction, as well as more than half of DD species in many other taxonomic groups, such as mammals and reptiles. Consequently, our predictions indicate that, amongst others, the conservation relevance of biodiversity hotspots in South America may be boosted by up to 20% if DD species were acknowledged. The predicted probabilities for DD species are highly variable across taxa and regions, implying current Red List-derived indices and priorities may be biased.",35927327,https://pubmed.ncbi.nlm.nih.gov/35927327/,PMC9352662,https://www.ncbi.nlm.nih.gov/pmc/articles/PMC9352662/,,
10.1038/s41559-022-01693-3,"Extinction, coextinction and colonization dynamics in plant-hummingbird networks under climate change.",Jesper Sonne; Pietro K Maruyama; Ana M Martín González; Carsten Rahbek; Jordi Bascompte; Bo Dalsgaard,2022-06-01,Nature ecology & evolution,"Climate-driven range shifts may cause local extinctions, while the accompanying loss of biotic interactions may trigger secondary coextinctions. At the same time, climate change may facilitate colonizations from regional source pools, balancing out local species loss. At present, how these extinction-coextinction-colonization dynamics affect biological communities under climate change is poorly understood. Using 84 communities of interacting plants and hummingbirds, we simulated patterns in climate-driven extinctions, coextinctions and colonizations under future climate change scenarios. Our simulations showed clear geographic discrepancies in the communities' vulnerability to climate change. Andean communities were the least affected by future climate change, as they experienced few climate-driven extinctions and coextinctions while having the highest colonization potential. In North America and lowland South America, communities had many climate-driven extinctions and few colonization events. Meanwhile, the pattern of coextinction was highly dependent on the configuration of networks formed by interacting hummingbirds and plants. Notably, North American communities experienced proportionally fewer coextinctions than other regions because climate-driven extinctions here primarily affected species with peripheral network roles. Moreover, coextinctions generally decreased in communities where species have few overlapping interactions, that is, communities with more complementary specialized and modular networks. Together, these results highlight that we should not expect colonizations to adequately balance out local extinctions in the most vulnerable ecoregions.",35347259,https://pubmed.ncbi.nlm.nih.gov/35347259/,,,,
10.1111/cobi.13896,"Extinction risk of the endemic vascular flora of Kauai, Hawaii, based on IUCN assessments.",Nina Rønsted; Seana K Walsh; Margaret Clark; Merlin Edmonds; Tim Flynn; Scott Heintzman; Alexander Loomis; David Lorence; Uma Nagendra; Ben Nyberg; Michael Opgenorth; Lauren Weisenberger; Adam Williams; Dustin Wolkis; Kenneth R Wood; Matthew Keir,2022-08-01,Conservation biology : the journal of the Society for Conservation Biology,"The International Union for Conservation of Nature's Red List of Threatened Species (IUCN Red List) is the world's most comprehensive information source on the global conservation status of species. Governmental agencies and conservation organizations increasingly rely on IUCN Red List assessments to develop conservation policies and priorities. Funding agencies use the assessments as evaluation criteria, and researchers use meta-analysis of red-list data to address fundamental and applied conservation science questions. However, the circa 143,000 IUCN assessments represent a fraction of the world's biodiversity and are biased in regional and organismal coverage. These biases may affect conservation priorities, funding, and uses of these data to understand global patterns. Isolated oceanic islands are characterized by high endemicity, but the unique biodiversity of many islands is experiencing high extinction rates. The archipelago of Hawaii has one of the highest levels of endemism of any floristic region; 90% of its 1367 native vascular plant taxa are classified as endemic. We used the IUCN's assessment of the complete single-island endemic (SIE) vascular plant flora of Kauai, Hawaii, to assess the proportion and drivers of decline of threatened plants in an oceanic island setting. We compared the IUCN assessments with federal, state, and other local assessments of Kauai species or taxa of conservation concern. Finally, we conducted a preliminary assessment for all 1044 native vascular plants of Hawaii based on IUCN criterion B by estimating area of occupancy, extent of occurrence, and number of locations to determine whether the pattern found for the SIE vascular flora of Kauai is comparable to the native vascular flora of the Hawaiian Islands. We compared our results with patterns observed for assessments of other floras. According to IUCN, 256 SIE vascular plant taxa are threatened with extinction and 5% are already extinct. This is the highest extinction risk reported for any flora to date. The preliminary assessment of the native vascular flora of Hawaii showed that 72% (753 taxa) is threatened. The flora of Hawaii may be one of the world's most threatened; thus, increased and novel conservation measures in the state and on other remote oceanic islands are urgently needed.",35146804,https://pubmed.ncbi.nlm.nih.gov/35146804/,PMC9544520,https://www.ncbi.nlm.nih.gov/pmc/articles/PMC9544520/,,
